accountName;accountHandle;text
Sadhguru Indonesian;SJV_Indonesian;#KutipanHarianSadhguru #SadhguruQuotes #DailyWisdom #mengajar #pendidikan #kebenaran
Melo Tukang Sampah Berdasi;melosky_83;Berbagi tips dasar pegang pensil yang benar YouTube #tukangsampahberdasi #pensil #dasar #mengajar #tamankanakkanak #paud #berbagi #ilmubermanfaat #orangtua #pendidikananakusiadini #pendidikanusiadini #anaktk #pendidikan #pendidikangurupenggerak #pendidikangurusekolahdasar #
A20T;AthoMoch;"Gak usah digoreng hingga buat gaduh. Motto Kemenag RI kan ""Ikhlas Beramal"" Oleh sebab itu, knp sy meski lulusan Pendidikan tdk mau jadi guru, krn guru adalah jln pengabdian, bkn pekerjaan. Jadi klo pengen kaya y berdagang #kementerianagama #kemenag #guru #pendidikan #kemenagri"
Mood Jabar;official45292;Pak @presidenrepublikindonesia tolong segera direalisasikan, kasihan para guru honor se-indonesia --- . . #moodindo #moodjabar #moodbekasi #indonesia #jawabarat #bekasi #kotabekasi #guru #guruhonorer #pendidikan #prabowo https://instagram.com/reel/DOLyjobgSWL/?igsh=MWtvamprZjBzMjVscw==…
JPapilaya;JPapilaya;Pemerintah fokuskan pendidikan di Tanah Papua sebagai prioritas untuk wujudkan Generasi Emas Indonesia. #PapuaNKRI #Pendidikan #IndonesiaReset #Beckysangels #Scholarships #PapuaIndonesia #googledown
Raja Media Network;RajamediaIDN;Kejagung resmi tetapkan mantan Mendikbudristek NAM sebagai tersangka kasus korupsi laptop Chromebook. Ditahan di Rutan Salemba 20 hari Kerugian negara: Rp1,98 T Sudah ada 4 tersangka lain #Korupsi #Kejagung #Pendidikan
lentera data;lenteradata;Kolaborasi Masmindo & Stikes Datu Kamanre bekali mahasiswa baru Luwu dengan ilmu K3 dan First Aid demi masa depan yang lebih siap dan berdaya saing. Yuk, share pendapatmu di kolom komentar! #PTMasmindoDwiArea #GenerasiMuda #Pendidikan #Kesehatan
Jennifer Sanjaya;JenniferSa57879;Sedih yang sangat sedih, Kapan negara ini maju jika orang-orang yang berada dibalik lembaga pendidikan dan agama terjerat kasus korupsi semua? #Nadiiem #Pendidikan
bppsdm_Poltekkpkarawang;PoltekKpKrw;Pertemuan rutin Dharma Wanita Persatuan Politeknik KP Karawang kali ini dirangkaikan dengan rapat persiapan dharma wisata serta demo memasak mie ayam. #PanganBiru #2025KKPRiseTogether #EkonomiBiruUntukIndonesiaEmas #SaktiWahyuTrenggono #KKPGOID #KKP #taruna #pendidikan
Kemenag Pidie;Kemenagpidie;Assalamualaikum #sahabatreligipidie Sosialisasi Pemutakhiran Data EMIS & Verval PD RA 2025/2026, wujud komitmen Kankemenag Pidie tingkatkan kualitas layanan Pendidikan. #kanwil #kemenag #kemenagri #kemenagaceh #kemenagpidie #aceh #pidie #asnberakhlak #emis #ra #pendidikan
HUMAS POLDA SULTENG;humaspolsulteng;Kapolda Sulteng melakukan pengecekan lokasi pembangunan SMP Kemala Bhayangkari Cabang Palu untuk memastikan proses percepatan pendirian sekolah berjalan lancar. Mendukung pendidikan yang berkualitas untuk generasi masa depan! #SMPKemalaBhayangkari #Pendidikan #Polri
SinarBestari;sinarbestarimy;Tahniah Monesha kerana berjaya mengharumkan nama SMK Seri Sepang di pentas debat. Segala usaha dan latihan yang konsisten akhirnya membuahkan hasil. Tahniah sekali lagi. #sinarbestari #pendidikan #smkserisepang #pelajar #debat #pendebat #terbaik #darulehsan #pasukan #kejayaan
Bellpods;bellpods_;Menelusuri transformasi Indonesia! Dari pengalaman naik pesawat pertama hingga dampak kripto di kampung. Yuk, simak bagaimana internet mengubah kehidupan! Tonton video lengkapnya di YouTube BellPods : https://youtu.be/6G7kAruX5JA?si #Indonesia #Inovasi #Kripto #Pendidikan
am.prastyo;amprastyo17;Paradoks Kurikulum Kokurikuler integrasi dengan 7GKAIH & 8DPL dsb Intrakurikuler diturunkan dari CP dsb Serasa tidak ada kausalitas antara satu dengan yang lain Curiga panduannya dibuat pakai AI #pendidikan
ANTARA JATENG;ANTARA_JATENG;PGRI Banjarnegara deklarasi damai jaga kondusifitas pendidikan #pendidikan #pgri #pgriindonesia #beritaterkini
Pak JITU;PakJITU;saat ini masih sebagai orang hilang. Kejanggalan-kejanggalan.. bersambung (Insya Allah) #oranghilang #biaya #Pendidikan #sekolah #siswa #pkl #laut #uptppa #komnas #ppa
Lemhannas RI;LemhannasRI;Sahabat Tannas, melalui penyusunan rekomendasi kebijakan ini, Lemhannas RI mengambil bagian dalam mewujudkan generasi unggul yang akan membawa Indonesia menuju kemajuan. #LemhannasRI #pendidikan #STEM
JatimSatuNews JSN;jatimsatunews;"""Pengabdian Seorang Guru Bukan Menjadi Beban"", sebuah artikel dari seorang guru di Kabupaten Malang, Jawa Timur. #jatim1news #artikel #pendidikan #guru #Indonesia"
TribunLombok.com;TribunLombokcom;Menag Nasaruddin Umar tegaskan, guru itu mulia, fokus memintarkan anak, bukan cari uang. Inspirasi untuk para pendidik! Baca selengkapnya: https://lombok.tribunnews.com/news/91908/menag-nasaruddin-umar-guru-itu-tujuannya-mulia-bagaimana-memintarkan-anak-orang-bukan-cari-uang… #Pendidikan #GuruMulia #MenagRI #InspirasiGuru
Bukan Kaleng Kaleng;BukanKK_;MITOS & FAKTA SAINS: PEREMPUAN TIDAK JAGO DALAM MATEMATIKA? PROF. STELLA #sains #wamen #pendidikan
didikpos.official;didikpos;Beasiswa dengan segudang manfaat lagi buka pendaftaran Pas banget buat kamu yang mau coba peluang baru! Daftar sekarang! Source: @candrasariani_ #pendidikan #indonesia #sekolah #belajar #pendidikanindonesia #education #mahasiswa #pendidikankarakter #bimbel #guru #edukasi
SinarBestari;sinarbestarimy;Jom amalkan 5 tip mudah untuk tingkatkan pemahaman, hafalan dan kemahiran menjawab soalan dalam mata pelajaran Sains. Semoga perkongsian ini membantu adik-adik meraih keputusan cemerlang dalam peperiksaan nanti. #sinarbestari #pendidikan #subjek #matapelajaran #Sains #pelajar
Biro Organisasi SETDA Provinsi Kalteng;Biroorg_Kalteng;Pemimpin Daerah Award 2025 Gubernur Kalteng H. Agustiar Sabran raih penghargaan Inovasi Daerah Bidang Pendidikan (28/8) dari Mendagri Tito Karnavian. Prestasi ini bukti komitmen Pemprov Kalteng majukan pendidikan merata hingga pelosok. #Kalteng #Pendidikan #Award
Flash Sukan;FlashSukan;Pengiktirafan bermakna buat Sultan Abdullah Ijazah Kehormat Falsafah daripada Universiti Tsukuba jadi bukti jasa Baginda dalam sukan dan pendidikan terus dihargai. https://flashsukan.com.my/sultan-abdullah-terus-julang-sukan-dan-pendidikan-terima-ijazah-kehormat-dari-universiti-tsukuba/… #SultanAbdullah #UniversitiTsukuba #Pendidikan #Sukan #MalaysiaJepun
cut sarah;cutsarah;Penerapan PJJ (Pembelajaran Jarak Jauh) di sekolah-sekolah dampak dari aksi demo anarkis. #DemokrasiTanpaAnarki #Pendidikan #IndonesiaReset #bist100 #TILFF2025_Yoko #BersatuDemiIndonesia
SMKN 1 Bondowoso;smk1bwsofficial;Cabang Dinas Pendidikan Wilayah Bondowoso gelar Sosialisasi Permendikdasmen No.II/2025 di SMKN 1 Bondowoso. Hadir perwakilan Waka Kurikulum & Operator Dapodik SMA/SMK se-Bondowoso & Situbondo. Upaya konkret tingkatkan efektivitas kerja guru! #Pendidikan #Bondowoso #Situbondo
Ebook Cikgu Mohd Fadli Salleh;EbookCikguFadli;PERKONGSIAN BAHAN PERCUMA Kad Kata Kerja Bergambar Sesuai untuk Pemulihan, Prasekolah & Tahun 1 Klik sini untuk muat turun percuma: https://cikgufadli.com/kad-kata-kerja-bergambar/… Sumber: Safia Waheeda Amirudin http://T.me/EbookCikguFadli. #BBM #Pendidikan #Pemulihan
suara trenggalek;SuaraTrenggalek;Dalam prosesnya, data akan disaring oleh Dinas Kominfo Trenggalek menjadi satu data konsolider yang bisa diakses melalui portal resmi Pemkab Trenggalek atau biasa lebih dikenal satu data #trenggalek #bupatitrenggalek #satudata #komitesekolah #pendidikan
JP Radar Mojokerto;radar_mojokerto;MENDAPAT TUGAS: Salah satu siswa madrasah di Jalan Raya Surodinawan Kota Mojokerto menerapkan pembelajaran daring akibat sekolahnya berdekatan dengan kawasan yang rawan sasaran aksi demonstrasi. https://radarmojokerto.jawapos.com/pendidikan/amp/826514265/sekolah-kota-terpaksa-terapkan-belajar-daring… #belajardaring #Pendidikan #mojokerto
Kemenag Pidie;Kemenagpidie;Selamat Hari Pendidikan Daerah! Mewujudkan Pendidikan Unggul, Menuju Aceh Maju #kanwil #kemenag #kemenagri #kemenagaceh #kemenagpidie #sahabatreligi #aceh #pidie #asnberakhlak #pendidikan #daerah
Agen Toleransi;YukToleran;yakni mengembangkan potensi peserta didik agar menjadi manusia yang beriman, bertakwa, berakhlak mulia, sehat, berilmu, cakap, kreatif, mandiri, dan menjadi warga negara yang demokratis& bertanggung jawab.#pendidikan #pendidikankarakter #indonesiaemas2045
Agen Toleransi;YukToleran;Sejalan dengan tujuan pendidikan nasional sebagaimana tercantum dalam Undang-Undang Nomor 20 Tahun 2003 tentang Sistem Pendidikan Nasional, #Pendidikan #pendidikankarakter #Indonesia #indonesiaemas2045 @Kemdikdasmen
Agen Toleransi;YukToleran;Revitalisasi PAUD (Pendidikan Anak Usia Dini) adalah upaya untuk meningkatkan kualitas dan relevansi pendidikan anak usia dini (0-6 tahun) melalui berbagai perubahan dan perbaikan dalam sistem pendidikan.#Pendidikan #pendidikankarakter #PAUD @Kemdikdasmen
Aminul Ummah;aminulummahs;Dengan ilmu, kita belajar optimis, percaya bahwa setiap anak punya potensi besar untuk mengubah dunia. #AminulUmmah #Optimis #Pendidikan #IlmuAdalahCahaya #GenerasiMasaDepan #BelajarSepanjangHayat #IslamicEducation #MotivasiBelajar #SemangatBelajar #HarapanBaru
didikpos.official;didikpos;Buat yang baru lulus SMA atau punya ijazah Diploma, ini saatnya kamu mulai karier! Ada 2 posisi loker yang tersedia langsung daftar sekarang ya! Source: @vgabriellaa #pendidikan #indonesia #sekolah #belajar #pendidikanindonesia #education #mahasiswa #pendidikankarakter #bimbel
Seketika;seketikanet;Tangsel bikin gebrakan! Hari Pramuka 2025 dirayakan sebulan penuh lewat Bulan Bakti Pramuka 2025 Anak TK sudah diajak gabung Pramuka Prasiaga! Udah tepat belum dikenalkan Pramuka? #Pramuka #Pendidikan #Karakter #Tangsel #update #news #seketika
谦 Iwan Pranoto;iwanpranoto;Manifesto Pendidikan, Forum Guru Besar ITB #pendidikan #pendidikanuntukperadaban
Volunteer MISI7;VMisi7;Masih Jauh Dari Sasaran. Jom Berwakaf! KEMPEN DANA SUMBANGAN WAKAF VAN SEKOLAH MURID ASNAF DI KUDAT, SABAH Kemaskini: 30-08-2025 Terkumpul: RM2,539/RM47,000 Butiran: https://vmisi7.com/wakaf27/ #sabah #kudat #wakaf #sahamakhirat #pendidikan #asnaf #MISI7 BANTU SEBARKAN
TribunLombok.com;TribunLombokcom;Dana Bantuan PIP September 2025 segera cair! Cek jadwal pencairan lengkap, cara cek penerima di http://pip.kemdikdasmen.go.id, dan besaran bantuannya di sini: https://lombok.tribunnews.com/news/91809/dana-bantuan-pip-september-2025-kapan-cair-simak-jadwal-lengkapnya-dan-cara-cek-pipdikdasmengoid… #PIP2025 #BantuanPIP #KIP #Bansos #Kemendikbud #Pendidikan
UBHINUS d.h. STIKI;ubhinusofficial;UBHINUS Tempat Mimpimu Berkembang Cashback 15% Uang Pangkal sampai 30 September 2025! Daftar sekarang di http://pmb.ubhinus.ac.id #kuliah #mahasiswa #universitas #kampusindonesia #pendidikan #mahasiswaindonesia #masukkampus #beasiswa
JatimSatuNews JSN;jatimsatunews;Fun Run dan Augmenta heboh, turut menghadirkan influencer di SMA Modern Al-Rifa'ie, Malang. #jatim1news #Malang #Jatim #pendidikan
RAJAMEDIA.CO;rmbantencom;Dindikbud Kota Serang tetapkan belajar daring utk PAUD, SD, SMP pada 1–4 Sept 2025. Antisipasi eskalasi sosial & keamanan Guru tetap jalankan kurikulum via online Orang tua lebih tenang, guru siap adaptasi #Serang #BelajarDaring #Pendidikan
demirakyatpenang;drpulaupinang;Kerajaan Persekutuan terus memberi perhatian serius terhadap pembangunan dan menaik taraf institusi pendidikan Islam di seluruh negara #MalaysiaMADANI #kerajaanPerpaduan #malaysiaviral #kerajaanMadani #Institusi #Pendidikan #Islam #DrZulkifliHasan #demirakyatpenang
Muhammadiyah;muhammadiyah;Rektor UAD: Guru Besar Harus Jadi Penjaga Marwah Keilmuan https://muhammadiyah.or.id/2025/09/rektor-uad-guru-besar-harus-jadi-penjaga-marwah-keilmuan/… #Pendidikan #Muhammadiyah
HUMAS POLRES DOMPU;polresdompuntb;Sat Polairud Polres Dompu bersama KP. XXI - 2014 Dit Polairud Polda NTB melaksanakan kegiatan sosial di Desa Calabai, Kecamatan Pekat, dengan menghadirkan layanan pendidikan dan kesehatan bagi masyarakat pesisir. #PolresDompu #Polairud #Dompu #NTB #HumasPolri #Pendidikan
Muhammadiyah;muhammadiyah;Irwan Akib: Jadikan Profesi Guru sebagai Panggilan Jiwa https://muhammadiyah.or.id/2025/08/irwan-akib-jadikan-profesi-guru-sebagai-panggilan-jiwa/… #Muhammadiyah #pendidikan
nabirenet;nabirenet;Dinas Pendidikan Deiyai Gelar Pertemuan Bersama Kepala Sekolah dan Operator Bahas DAPODIK 2026 Baca selengkapnya di http://Nabire.Net https://nabire.net/dinas-pendidikan-deiyai-gelar-pertemuan-bersama-kepala-sekolah-dan-operator-bahas-dapodik-2026/… #Deiyai #Pendidikan #DAPODIK2026 #BOSP #RKAS2026 #PapuaTengah
didikpos.official;didikpos;Info Beasiswa 2025 sudah dibuka!! Tersedia untuk S1/D3/D4, SMA, SMP bahkan umum. Yuk buruan cek peluangnya sekarang!! Source Tiktok/@rusli.id #pendidikan #indonesia #sekolah #belajar #pendidikanindonesia #education #mahasiswa #pendidikankarakter #bimbel #guru #edukasi
suara trenggalek;SuaraTrenggalek;Setelah ratusan siswa menggelar aksi, Dewan Perwakilan Rakyat Daerah (DPRD) Trenggalek menegaskan siap mengawal kasus tersebut dan meminta tidak ada intimidasi terhadap para pelajar. #trenggalek #dprd #dpr #sma #pendidikan
Muhammadiyah;muhammadiyah;Muhammadiyah–Kemendikdasmen Kolaborasi, Dorong Pendidikan Bermutu Lewat Deep Learning https://muhammadiyah.or.id/2025/08/muhammadiyah-kemendikdasmen-kolaborasi-dorong-pendidikan-bermutu-lewat-deep-learning/… #Muhammadiyah #Pendidikan
